Title,Price,Rating,Discount,Source,URL
"Nokia All-new 105 Single Sim Keypad Phone with Built-in UPI Payments, Long-Lasting Battery, Wireless FM Radio| 1 Year Replacement Guarantee | Charcoal",Rs.1199,N/A,(25% off),Amazon,N/A
OnePlus 15R | 12GB+256GB | Charcoal Black | World's First Snapdragon® 8 Gen 5 | 7400mAh Battery | Personalised AI | Game-Changing 165Hz Display | IP68 IP69 IP66 & IP69K | 4K 120fps Video,Rs.50499,N/A,(8% off),Amazon,N/A
"REDMI Note 15 5G (Black, 8GB RAM 256GB Storage) | 108MP OIS Camera | Snapdragon 6 Gen 3 | 17.2cm Tough Curved AMOLED Screen | Segment's Slimmest Phone | 5520mAh Battery | 45W Fast Charging",Rs.27999,N/A,(3% off),Amazon,N/A
"it5027 Slim with 2.4"" Big Display, 1200 mAh Battery, Kingvoice, Type-C Charger, Ultra-Slim with 11mm Thickness & VGA Rear Camera | Blue",Rs.1101,N/A,(33% off),Amazon,N/A
"K&F Concept 60'' Camera Phone Tripod Stand, 1.34 lbs Ultra Lightweight with Remote and Cellphone Holder, 360° Panorama, Cold Shoe Interface, Portable for Travel - B174A1",Rs.1598,N/A,(85% off),Amazon,N/A
"K&F Concept Clip On 67mm Variable ND2-32 Magnetic Phone Lens Filter Kit, Phone Clip with Magnetic Adapter Ring/Cold Shoe/Locking Knob, Neutral Density Filter for iPhone 15 Pro Max 14 13",Rs.9284,N/A,(24% off),Amazon,N/A
"K&F Concept Clip On 67mm CPL Magnetic Phone Lens Filter Kit, Phone Clip with Magnetic Adapter Ring/Cold Shoe/Locking Knob, Polarizer Filter for iPhone 15 Pro Max 14 13",N/A,N/A,(1 new offer),Amazon,N/A
Soft Silicone TPU Flexible Back Cover Compatible with Redmi K50i/ K 50i with Phone Ring Holder and Screen Guard,Rs.349,N/A,(63% off),Amazon,N/A
"USB-A to Micro USB for Oppo A1k, A1 K, A 1 K 2.4A Fast Charging Cable For Android Phones/Tablets, 480mbps Data Transfer Speed, Made in India, Tangle-free USB Cable Round, 1M (KK1, White)",Rs.289,N/A,(71% off),Amazon,N/A
"Bike Handle Mount Mobile Phone Holder Aluminium Metal 360 Degree Rotation for All Smartphones Motorcycle, Scooty Black",Rs.249,N/A,(58% off),Amazon,N/A
"2PCS Phone Charms for Girls, Charms for Phone Case, Cute Star and Flower Keychain Set for K-pop Albums and Photo Cards, Phone Charms Collection for Gift",Rs.259,N/A,(7% off),Amazon,N/A
"RM Protective Phone Case for Oppo K 12X 5G, Black Bumper Frame, Cute 3D Cartoon Design with Decorative Panda Figure (PC & TPU)",Rs.499,N/A,(50% off),Amazon,N/A
"Magnetic Car Phone Mount Holder, Universal Dashboard Mount, Black, 360-Degree Rotation, 2.1-inch Base Diameter (K-007)",Rs.273,N/A,(70% off),Amazon,N/A
"K.B.SALES 6 Slots Mobile Phone Storage Box Lockable Mobile Phone Jail Aluminum Alloy Clear Cell Phones Storage Cabinet, Locker Box with Handle 6 Mobile Phone Holder Cabinet Storage Box Organizer",Rs.1299,N/A,(48% off),Amazon,N/A
Pocket | iPhone Farbric Bag | Carry Pouch Bag | iPhone Pocket | 3D Knitted Stretch Phone Pouch | Mobile (only Black),Rs.299,N/A,(77% off),Amazon,N/A
"Radha Chubby Panda Phone Case for Oppo K 12X 5G, Black Flexible Cover with 3D Panda Design",Rs.499,N/A,(50% off),Amazon,N/A
Soft Silicone TPU Flexible Back Cover Compatible with Redmi K50i/ K 50i with Phone Holder Gel PAD,Rs.289,N/A,(68% off),Amazon,N/A
Soft Silicone TPU Flexible Back Cover Compatible with Redmi K50i/ K 50i with Phone Holder Gel PAD and Screen Guard,Rs.369,N/A,(63% off),Amazon,N/A
"Radha Chubby Panda Phone Case for Oppo K 13 Turbo 5G, Black Flexible Cover with 3D Panda Design",Rs.499,N/A,(50% off),Amazon,N/A
"Initial Letter 'K' Phone Charm, Black and Gold Pendant with Cord Strap",Rs.99,N/A,(60% off),Amazon,N/A
"Initial Letter 'K' Charm Phone Strap, Metal Pendant with Black Cord, Mobile Accessory for Bags and Wallets",Rs.99,N/A,(60% off),Amazon,N/A
